Authors,Year,Title,Abstract,Journal,Volume,Issue,Pages,DOI
"K. Dhindsa, V. Drobinin, J. King, G. B. Hall, N. Burgess and S. Becker",2014,"Examining the role of the temporo-parietal network in memory, imagery, and viewpoint transformations","The traditional view of the medial temporal lobe (MTL) focuses on its role in episodic memory. However, some of the underlying functions of the MTL can be ascertained from its wider role in supporting spatial cognition in concert with parietal and prefrontal regions. The MTL is strongly implicated in the formation of enduring allocentric representations (e.g., O’Keefe, 1976; King et al., 2002; Ekstrom et al., 2003). According to our BBB model (Byrne et al., 2007), these representations must interact with head-centered and body-centered representations in posterior parietal cortex via a transformation circuit involving retrosplenial areas. Egocentric sensory representations in parietal areas can then cue the recall of allocentric spatial representations in long-term memory and, conversely, the products of retrieval in MTL can generate mental imagery within a parietal “window.” Such imagery is necessarily egocentric and forms part of visuospatial working memory, in which it can be manipulated for the purpose of planning/imagining the future. Recent fMRI evidence (Lambrey et al., 2012; Zhang et al., 2012) supports the BBB model. To further test the model, we had participants learn the locations of objects in a virtual scene and tested their spatial memory under conditions that impose varying demands on the transformation circuit. We analyzed how brain activity correlated with accuracy in judging the direction of an object (1) from visuospatial working memory (we assume transient working memory due to the order of tasks and the absence of change in viewpoint, but long-term memory retrieval is also possible), (2) after a rotation of viewpoint, or (3) after a rotation and translation of viewpoint (judgment of relative direction). We found performance-related activity in both tasks requiring viewpoint rotation (ROT and JRD, i.e., conditions 2 and 3) in the core medial temporal to medial parietal circuit identified by the BBB model. These results are consistent with the predictions of the BBB model, and shed further light on the neural mechanisms underlying spatial memory, mental imagery and viewpoint transformations. (PsycINFO Database Record (c) 2016 APA, all rights reserved) (Source: journal abstract)",Frontiers in Human Neuroscience,8,,13,10.3389/fnhum.2014.00709
"B. L. Drisdelle, K. Konishi, M. Diarra, V. D. Bohbot, P. Jolicoeur and G. L. West",2017,Electrophysiological evidence for enhanced attentional deployment in spatial learners,"Visual spatial attention is important during navigation processes that rely on a cognitive map, because spatial relationships between environmental landmarks need to be selected, encoded, and learned. People who navigate using this strategy are spatial learners, and this process relies on the hippocampus. Conversely, response learners memorize a series of actions to navigate, which relies on the caudate nucleus. Response learning, which is more efficient, is thought to involve less demanding cognitive operations, and is related to reduced grey matter in the hippocampus. To test if navigational strategy can impact visual attention performance, we investigated if spatial and response learners showed differences in attentional engagement used during a visual spatial task. We tested 40 response learners and 39 spatial learners, as determined by the 4-on-8 Virtual Maze (4/8 VM), on a target detection task designed to elicit an N2pc component (an index visual spatial attention). Spatial learners produced a larger N2pc amplitude during target detection compared to response learners. This relationship might represent an increase in goal-directed attention towards target stimuli or a more global increase in cognitive function that has been previously observed in spatial learners.",Experimental Brain Research,235,5,1387-1395,10.1007/s00221-017-4884-9
"E. Eich, A. L. Nelson, M. A. Leghari and T. C. Handy",2009,Neural systems mediating field and observer memories,"Autobiographical memories are more imbued with affect when one adopts a first-person or field perspective during event retrieval, rather than a third-person or observer perspective. We combined fMRI, event narratives, and subjective ratings to identify the neural networks engaged with field versus observer memories for real-world events. Our results revealed significant decreases in bilateral insula and left somato-motor activity during the recall of observer memories, paired with a small relative increase in right posterior amygdala activity coincident with the recall of field memories. Notably, these regions showed no overlap with those areas mediating the narrative content and subjective emotionality of the remembered events. Our findings suggest that the emotionality of field relative to observer memories is not simply driven by increased limbic activation when one adopts a first-person retrieval perspective. Rather, there is also a significant reduction in one's cortical representations of the physical, embodied self when a third-person—or disembodied—perspective is taken at retrieval. (PsycINFO Database Record (c) 2018 APA, all rights reserved) (Source: journal abstract)",Neuropsychologia,47,11,2239-2251,10.1016/j.neuropsychologia.2009.02.019
"A. D. Ekstrom, D. J. Huffman and M. Starrett",2017,Interacting networks of brain regions underlie human spatial navigation: a review and novel synthesis of the literature,"Navigation is an inherently dynamic and multimodal process, making isolation of the unique cognitive components underlying it challenging. The assumptions of much of the literature on human spatial navigation are that 1) spatial navigation involves modality independent, discrete metric representations (i.e., egocentric vs. allocentric), 2) such representations can be further distilled to elemental cognitive processes, and 3) these cognitive processes can be ascribed to unique brain regions. We argue that modality-independent spatial representations, instead of providing exact metrics about our surrounding environment, more often involve heuristics for estimating spatial topology useful to the current task at hand. We also argue that egocentric (body centered) and allocentric (world centered) representations are better conceptualized as involving a continuum rather than as discrete. We propose a neural model to accommodate these ideas, arguing that such representations also involve a continuum of network interactions centered on retrosplenial and posterior parietal cortex, respectively. Our model thus helps explain both behavioral and neural findings otherwise difficult to account for with classic models of spatial navigation and memory, providing a testable framework for novel experiments.",Journal of neurophysiology,118,6,3328-3344,10.1152/jn.00531.2017
A. D. Ekstrom and C. Ranganath,2017,"Space, time, and episodic memory: The hippocampus is all over the cognitive map","In recent years, the field has reached an impasse between models suggesting that the hippocampus is fundamentally involved in spatial processing and models suggesting that the hippocampus automatically encodes all dimensions of experience in the service of memory. Here, we consider key conceptual issues that have impeded progress in our understanding of hippocampal function, and we review findings that establish the scope and limits of hippocampal involvement in navigation and memory. We argue that space and time serve as a primary scaffold to break up experiences into specific contexts, and to organize multimodal input that is to be associated within a context. However, the hippocampus is clearly capable of incorporating additional dimensions into the scaffold if they are determined to be relevant in the event-defined context. Conceiving of the hippocampal representation as constrained by immediate task demands-yet preferring axes that involve space and time-helps to reconcile an otherwise disparate set of findings on the core function of the hippocampus.",Hippocampus,,,,
"D. Feyers, F. Collette, A. D'Argembeau, S. Majerus and E. Salmon",2010,Neural networks involved in self-judgement in young and elderly adults,"Recent studies have shown that both young and elderly subjects activate the ventromedial prefrontal cortex (VMPFC) when they make self-referential judgements. However, the VMPFC might interact with different brain regions during self-referencing in the two groups. In this study, based on data from Ruby et al. (2009), we have explored this issue using psychophysiological interaction analyses. Young and elderly participants had to judge adjectives describing personality traits in reference to the self versus a close friend or relative (the other), taking either a first-person or a third-person perspective. The physiological factor was the VMPFC activity observed in all participants during self-judgement, and the psychological factor was the self versus other referential process. The main effect of first-person perspective in both groups revealed that the VMPFC was co-activated with the left parahippocampal gyrus and the precuneus for self versus other judgments. The main effect of age showed a stronger correlation between activity in the VMPFC and the lingual gyrus in young compared to elderly subjects. Finally, in the interaction, the VMPFC was specifically co-activated with the orbitofrontal gyrus and the precentral gyrus when elderly subjects took a first-person perspective for self-judgements. No significant result was observed for the interaction in young subjects. These findings show that, although the VMPFC is engaged by both young and older adults when making self-referential judgements, this brain structure interacts differently with other brain regions as a function of age and perspective. These differences might reflect a tendency by older people to engage in more emotional/social processing than younger adults when making self-referential judgements with a first-person perspective.",Neuroimage,53,1,341-347,10.1016/j.neuroimage.2010.05.071
A. A. Fingelkurts,2011,Persistent operational synchrony within brain default-mode network and self-processing operations in healthy subjects,"Based on the theoretical analysis of self-consciousness concepts, we hypothesized that the spatio-temporal pattern of functional connectivity within the default-mode network (DMN) should persist unchanged across a variety of different cognitive tasks or acts, thus being task-unrelated. This supposition is in contrast with current understanding that DMN activated when the subjects are resting and deactivated during any attention-demanding cognitive tasks. To test our proposal, we used, in retrospect, the results from our two early studies (Fingelkurts, 1998; Fingelkurts et al., 2003). In both studies for the majority of experimental trails we indeed found a constellation of operationally synchronized cortical areas (indexed as DMN) that was persistent across all studied experimental conditions in all subjects. Furthermore, we found three major elements comprising this DMN: two symmetrical occipito-parieto-temporal and one frontal spatio-temporal patterns. This new data directly supports the notion that DMN has a specific functional connotation - it provides neurophysiologic basis for self-processing operations, namely first-person perspective taking and an experience of agency. Crown Copyright (C) 2010 Published by Elsevier Inc. All rights reserved.",Brain and Cognition,75,2,79-90,10.1016/j.bandc.2010.11.015
A. A. Fingelkurts,2017,Three-dimensional components of selfhood in treatment-naive patients with major depressive disorder: A resting-state qEEG imaging study,"Based on previous studies implicating increased functional connectivity within the self-referential brain network in major depressive disorder (MDD), and considering the functional roles of three distinct modules of such brain net (responsible for three-dimensional components of Selfhood) together with the documented abnormalities of self-related processing in MDD, we tested the hypothesis that patients with depression would exhibit increased connectivity within each module of the self-referential brain network and that the strength of these connections would correlate positively with depression severity. Applying the electroencephalogram (EEG) operational synchrony analysis to extract three modules of the self-referential brain network in 12 medication-free depressive outpatients and 10 control subjects we have found an increase in the strength of EEG synchrony within all three modules in depressive patients (though non-significant for the right module). Furthermore, multiple regression analysis that used 3 factors (values of synchrony strength for all three modules) as input indicated that combined increase in the strength of synchrony in all three modules was positively associated with severity of depression. Taken together the findings of this study suggest that depression is primarily associated with hypersynchrony in all three modules of the brain self-referential network (the anterior module been responsible for witnessing observation and first-person perspective, the left posterior module been responsible for reflective agency and narration and the right posterior module been responsible for bodily representational-emotional agency), thus contributing to excessive self-focus, rumination, and body tension.",Neuropsychologia,99,,30-36,10.1016/j.neuropsychologia.2017.02.020
"A. A. Fingelkurts, S. Bagnato, C. Boccagni and G. Galardi",2016,The Chief Role of Frontal Operational Module of the Brain Default Mode Network in the Potential Recovery of Consciousness from the Vegetative State: A Preliminary Comparison of Three Case Reports,"It has been argued that complex subjective sense of self is linked to the brain default-mode network (DMN). Recent discovery of heterogeneity between distinct subnets (or operational modules - OMs) of the DMN leads to a reconceptualization of its role for the experiential sense of self. Considering the recent proposition that the frontal DMN OM is responsible for the first-person perspective and the sense of agency, while the posterior DMN OMs are linked to the continuity of 'I' experience (including autobiographical memories) through embodiment and localization within bodily space, we have tested in this study the hypothesis that heterogeneity in the operational synchrony strength within the frontal DMN OM among patients who are in a vegetative state (VS) could inform about a stable self-consciousness recovery later in the course of disease (up to six years post-injury). Using EEG operational synchrony analysis we have demonstrated that among the three OMs of the DMN only the frontal OM showed important heterogeneity in VS patients as a function of later stable clinical outcome. We also found that the frontal DMN OM was characterized by the process of active uncoupling (stronger in persistent VS) of operations performed by the involved neuronal assemblies.",Open Neuroimag J,10,,41-51,10.2174/1874440001610010041
"A. A. Fingelkurts, A. A. Fingelkurts, S. Bagnato, C. Boccagni and G. Galardi",2016,The Chief Role of Frontal Operational Module of the Brain Default Mode Network in the Potential Recovery of Consciousness from the Vegetative State: A Preliminary Comparison of Three Case Reports,"It has been argued that complex subjective sense of self is linked to the brain default-mode network (DMN). Recent discovery of heterogeneity between distinct subnets (or operational modules - OMs) of the DMN leads to a reconceptualization of its role for the experiential sense of self. Considering the recent proposition that the frontal DMN OM is responsible for the first-person perspective and the sense of agency, while the posterior DMN OMs are linked to the continuity of 'I' experience (including autobiographical memories) through embodiment and localization within bodily space, we have tested in this study the hypothesis that heterogeneity in the operational synchrony strength within the frontal DMN OM among patients who are in a vegetative state (VS) could inform about a stable self-consciousness recovery later in the course of disease (up to six years post-injury). Using EEG operational synchrony analysis we have demonstrated that among the three OMs of the DMN only the frontal OM showed important heterogeneity in VS patients as a function of later stable clinical outcome. We also found that the frontal DMN OM was characterized by the process of active uncoupling (stronger in persistent VS) of operations performed by the involved neuronal assemblies.",The open neuroimaging journal,10,,41-51,10.2174/1874440001610010041
H. Finnbogadottir and D. Berntsen,2011,Involuntary and voluntary mental time travel in high and low worriers,"Worry as a trait is an individual's general tendency to become worried, which in severe cases is associated with the diagnosis Generalised Anxiety Disorder. Mental time travel (MTT) is the ability to mentally project oneself into one's personal past or future, in terms of memories of personal past events or projections of possible events in the personal future. MTT can be voluntarily initiated or occur involuntarily. The current exploratory study investigated involuntary and voluntary MTT in the context of trait worry, thereby bringing together research on worry and MTT. High (N=20) and low (N=16) worriers recorded involuntary and voluntary autobiographical memories and future projections using a structured diary method. We predicted that MTT in high worriers would show signs of cognitive avoidance, such as reduced emotional intensity, more observer perspective, less visual imagery, or coming up with overgeneral or less self-relevant events. We found only partial support for our hypotheses in that high worriers rated personal memories and future projections lower on measures of self-relevance than did low worriers.",Memory,19,6,625-640,10.1080/09658211.2011.595722
H. Finnbogadóttir and D. Berntsen,2014,Looking at life from different angles: Observer perspective during remembering and imagining distinct emotional events,"We examined the use of observer perspective—that is, seeing oneself from an observer’s perspective when remembering and imagining personal events—in relation to worry and other types of maladaptive thinking styles. We examined this relation across a range of discrete emotions. In Study 1, we found that high worriers compared with low worriers use more observer perspective when remembering and imagining emotional (fear, joy, shame, pride), important, and word-cued events. Across emotional and word-cued events, and for both past and future temporal direction, high worriers reported more observer perspective than low worriers. In Study 2, we examined the use of visual perspective in relation to worry and other measures of negative affect and thinking styles, when remembering events involving positive versus negative evaluation of self versus others (shame, pride, contempt, admiration). We found that measures of general anxiety, symptoms of social anxiety, and rumination were associated with greater observer perspective, whereas reflection was associated with more field perspective. Together, the 2 studies show that high levels of maladaptive thinking and negative affect are associated with using more observer perspective when imagining and remembering autobiographical events across a range of emotions. (PsycINFO Database Record (c) 2016 APA, all rights reserved) (Source: journal abstract)","Psychology of Consciousness: Theory, Research, and Practice",1,4,387-406,
H. Finnbogadottir and D. K. Thomsen,2013,Review: Does maladaptive repetitive thinking affect characteristics of mental time travel?,"We review studies examining the relationship between maladaptive repetitive thinking (RT) and the following characteristics of mental time travel (MTT): (1) emotional response (22 studies), (2) sensory reliving (3 studies), (3) field-observer perspective (4 studies) and (4) reduced specificity (29 studies). The results suggest that maladaptive RT is associated with increased emotional response to mentally travelling to negative events and with reduced specificity of past MTT. The results for sensory reliving and field-observer perspective were mixed. We discuss why maladaptive RT is associated with both increased emotional response and reduced specificity, which has been suggested to decrease emotional responses to MTT. We suggest that differences in the conceptualization of maladaptive RT and sampling clinical versus healthy participants may explain this apparently contradictory finding. Alternatively, maladaptive RT may be characterized by both increased emotional response to MTT and attempts at reducing the emotional response through reduced specificity. Finally, we offer suggestions for future research. (PsycINFO Database Record (c) 2016 APA, all rights reserved) (Source: journal abstract)",Nordic Psychology,65,2,137-165,
"C. Fouquet, C. Tobin and L. Rondi-Reig",2010,A new approach for modeling episodic memory from rodents to humans: The temporal order memory,"One of the crucial issues in actual research on memory disorders and particularly in Alzheimer's disease is the development of behavioral tasks accurately testing episodic memory, a type of memory sensitive to aging and altered early during neurodegenerative disorders. Translational research allowing comparison of similar memory properties between human and rodent models is a requirement for the finding of behavioral and cognitive biomarkers as well as molecular deficits associated to the pathology. In this review, we propose that the ability to remember an ordered sequence of choices during spatial navigation could be one of the episodic memory properties shared by human and rodent models. The ability to learn the correct sequence of choices depends on the hippocampus, requires flexibility and is particularly sensitive to age-related decline in rodents as in humans. In an innovative approach, we took advantage of a well characterized rodent navigation task, the starmaze, to develop a new model of episodic allowing creating and objective experimental testing of a personal past experience without requiring verbal report which can be transferred to human.",Behavioural Brain Research,215,2,172-179,10.1016/j.bbr.2010.05.054
"M. Freton, C. Lemogne, L. Bergouignan, P. Delaveau, S. Lehericy and P. Fossati",2014,The eye of the self: precuneus volume and visual perspective during autobiographical memory retrieval,"Visual perspective (i.e. first-person versus third-person perspective) during autobiographical memory (AM) retrieval plays a role in both emotional regulation and self-related processes. However, its neural underpinnings remain mostly unexplored. Visual perspective during AM retrieval was assessed in two independent datasets of 45 and 20 healthy young adults with two different AM retrieval tasks. Diffeomorphic anatomical registration using exponentiated lie algebra and voxel-based morphometry were used to assess individual differences in the precuneus grey matter volume. The spontaneous tendency to recall memories from a first-person perspective was positively correlated with the right precuneus volume among the two independent datasets. Whole-brain analyses revealed that these results were relatively specific to the anterior part of the right precuneus. Our results provide first evidence for the role of the precuneus in egocentric spatial processing in the context of AM retrieval among healthy subjects.",Brain Struct Funct,219,3,959-968,10.1007/s00429-013-0546-2
"L. Frings, K. Wagner, A. Quiske, R. Schwarzwald, J. Spreer, U. Halsband and A. Schulze-Bonhage",2006,Precuneus is involved in allocentric spatial location encoding and recognition,"Using a declarative memory paradigm, the anatomical correlates of spatial location encoding and retrieval in the healthy human brain as reflected by BOLD fMRI were investigated. During encoding, subjects were instructed to view and keep in mind different locations of an object on a platform seen from different viewpoints in virtual 3D. In retrieval trials, subjects had to recognize previously learned object locations. Comparing activation patterns associated with encoding and recognition on a voxel-by-voxel basis, we found regions in the precuneus bilaterally activated by both processes. To our knowledge, this is the first study that directly compared human brain activation patterns associated with allocentric encoding and retrieval of spatial locations in virtual 3D. Our results provide further information concerning the role of the precuneus in declarative memory processes, pointing to precuneus involvement in encoding and retrieval of spatial locations.",Experimental Brain Research,173,4,661-672,10.1007/s00221-006-0408-8
