Authors,Year,Title,Abstract,Journal,Volume,Issue,Pages,DOI
G. Riva,2016,Neurobiology of anorexia nervosa: Serotonin dysfunctions link self-starvation with body image disturbances through an impaired body memory,"The etiology of anorexia nervosa (AN) is still unclear, despite that it is a critical and potentially mortal illness. A recent neurobiological model considers AN as the outcome of dysfunctions in the neuronal processes related to appetite and emotionality (Kaye et al., 2009, 2013). However, this model still is not able to answer a critical question: What is behind body image disturbances (BIDs) in AN? The article starts its analysis from reviewing some of the studies exploring the effects of the serotonin systems in memory (episodic, working, and spatial) and its dysfunctions. The review suggests that serotonin disturbances may: (a) facilitate the encoding of third person (allocentric) episodic memories; (b) facilitate the consolidation of emotional episodic memories (e.g., teasing), if preceded by repeated stress; (c) reduce voluntary inhibition of mnestic contents; (d) impair allocentric spatial memory. If we discuss these results within the interpretative frame suggested by the “Allocentric Lock Hypothesis” (Riva, 2012, 2014), we can hypothesize that altered serotoninergic activity in AN patients: (i) improves their ability to store and consolidate negative autobiographical memories, including those of their body, in allocentric perspective; (ii) impairs their ability to trigger voluntary inhibition of the previously stored negative memory of the body; (iii) impairs their capacity to retrieve/update allocentric information. Taken together, these points suggest a possible link between serotonin dysfunctions, memory impairments and BIDs: the impossibility of updating a disturbed body memory using real time experiential data—I’m locked to a wrong body stored in long term memory—pushes AN patients to control body weight and shape even when underweight. (PsycINFO Database Record (c) 2016 APA, all rights reserved) (Source: journal abstract)",Frontiers in Human Neuroscience,10,,10,10.3389/fnhum.2016.00600
G. Riva and A. Dakanalis,2018,Altered Processing and Integration of Multisensory Bodily Representations and Signals in Eating Disorders: A Possible Path Toward the Understanding of Their Underlying Causes,"According to the Diagnostic and Statistical Manual of Mental Disorders (DSM V) eating problems are the clinical core of eating disorders (EDs). However, the importance of shape and weight overvaluation symptoms in these disorders underlines the critical role of the experience of the body in the etiology of EDs. This article suggests that the transdiagnostic centrality of these symptoms in individuals with EDs may reflect a deficit in the processing and integration of multisensory bodily representations and signals. Multisensory body integration is a critical cognitive and perceptual process, allowing the individual to protect and extend her/his boundaries at both the homeostatic and psychological levels. To achieve this goal the brain integrates sensory data arriving from real-time multiple sensory modalities and internal bodily information with predictions made using the stored information about the body from conceptual, perceptual, and episodic memory. In this view the emotional, visual, tactile, proprioceptive and interoceptive deficits reported by many authors in individuals with EDs may reflect a broader impairment in multisensory body integration that affects the individual's abilities: (a) to identify the relevant interoceptive signals that predict potential pleasant (or aversive) consequences; and (b) to modify/correct the autobiographical allocentric (observer view) memories of body related events (self-objectified memories). Based on this view, the article also proposes a strategy, based on new technologies (i.e., virtual reality and brain/body stimulation), for using crossmodal associations to reactivate and correct the multisensory body integration processes.",Frontiers in human neuroscience,12,,49,10.3389/fnhum.2018.00049
G. Riva and S. Gaudio,2012,Allocentric lock in anorexia nervosa: New evidences from neuroimaging studies,Individuals with anorexia nervosa (AN) have a disturbance in the way in which their body is experienced and tend to evaluate negatively their own body and body parts. It is controversial whether these symptoms are secondary to dysfunctions in the neuronal processes related to appetite and emotional regulation or reflect a primary disturbance in the way the body is experienced and remembered. According to the Allocentric Lock Hypothesis--ALH (http://dx.doi.org/10.1016/j.mehy.2011.10.039) individuals with AN may be locked to an allocentric (observer view) negative memory of the body that is no more updated by contrasting egocentric representations driven by perception. Recent neuroimaging studies are showing several structural and functional alterations in frame- and memory-related body-image-processing brain circuits that may support ALH.,Medical Hypotheses,79,1,113-117,10.1016/j.mehy.2012.03.036
D. J. Robinaugh and R. J. McNally,2010,Autobiographical memory for shame or guilt provoking events: association with psychological symptoms,"The diagnostic criteria for posttraumatic stress disorder (PTSD) specify that a qualifying traumatic stressor must incite extreme peritraumatic fear, horror, or helplessness. However, research suggests that events inciting guilt or shame may be associated with PTSD. We devised a web-based survey in which non-clinical participants identified an event associated with shame or guilt and completed questionnaire measures of shame, guilt, PTSD, and depression. In addition, we assessed characteristics of memory for the event, including visual perspective and the centrality of the memory to the participant's autobiographical narrative (CES). Shame predicted depression and PTSD symptoms. There was no association between guilt and psychological symptoms after controlling statistically for the effects of shame. CES predicted the severity of depression and PTSD symptoms. In addition, CES mediated the moderating effect of visual perspective on the relationship between emotional intensity and PTSD symptoms. Our results suggest shame is capable of eliciting the intrusive and distressing memories characteristic of PTSD. Furthermore, our results suggest aversive emotional events are associated with psychological distress when memory for those events becomes central to one's identity and autobiographical narrative.",Behaviour research and therapy,48,7,646-652,10.1016/j.brat.2010.03.017
J. A. Robinson and K. L. Swanson,1993,Field and observer modes of remembering,"Sampled personal memories from several life periods among 90 college students and assessed ability to change the initially reported perspective. Changing was easier for recent or vividly recalled events, harder for older and less vividly recalled events. Memory perspectives may differ in other aspects than their imagery. A 2nd study was conducted with 64 college students to determine whether affective experience is altered when perspectives are changed. The affect experienced decreased when shifting from a field to an observer perspective, but did not change with the converse shift. These studies provide further evidence that remembering is more than retrieval. The information that enters awareness is determined by the information sources in memory and the organizational scheme adopted for recollection. (PsycINFO Database Record (c) 2016 APA, all rights reserved)",Memory,1,3,169-184,10.1080/09658219308258230
"R. A. P. Roche, M. A. Mangaoang, S. Commins and S. M. O'Mara",2005,Hippocampal contributions to neurocognitive mapping in humans: A new model,"The ability of an organism to develop, maintain, and act upon an abstracted internal representation of spatially extensive environments can provide an increased chance in ensuring that organism's survival. Here, we propose a neurocognitive model of spatial representation describing how several different processes interact and segregate the differing types of information used to produce a unified cognitive map. This model proposes that view-based egocentric and vestibulomotor translational information are functionally and anatomically separate, and that these parallel systems result in independent, but interacting, models within a neurocognitive map of space. In this context, we selectively review relevant portions of the large literature, addressing the establishment and operation of such spatial constructs in humans and the brain systems that underpin them, with particular reference to the hippocampal formation (HF). We present a reinterpretation of the types of knowledge used in the formation of this spatial construct, the processes that act upon this information, the nature of the final spatial representation, and describe how these universal concepts relate to the proposed model of spatial processing. The relevant experimental paradigms used to examine the neural basis of spatial representation and the main findings from previous research are also briefly presented. Finally, we detail a series of testable theoretical, behavioral, and anatomical predictions made by the model.",Hippocampus,15,5,622-641,10.1002/hipo.20084
"G. Rode, C. Pagliari, L. Huchon, Y. Rossetti and L. Pisella",2017,Semiology of neglect: An update,"Hemispatial neglect is a common disabling condition following brain damage to the right hemisphere. Generally, it involves behavioral bias directed ipsilaterally to the damaged hemisphere and loss of spatial awareness for the contralesional side. In this syndrome, several clinical subtypes were identified. The objective of this article is to provide a nosological analysis of the recent data from the literature on the different subtypes of neglect (visual, auditory, somatosensory, motor, egocentric, allocentric and representational neglect), associated ipsilesional and contralesional productive manifestations and their anatomical lesion correlates. These different anatomical-clinical subtypes can be associated or dissociated. They reflect the heterogeneity of this unilateral neglect syndrome that cannot be approached or interpreted in a single manner. We propose that these subtypes result from different underlying deficits: exogenous attentional deficit (visual, auditory neglect); representational deficit (personal neglect, representational neglect, hyperschematia); shift of the egocentric reference frame (egocentric neglect); attentional deficit between objects and within objects (allocentric neglect), endogenous attentional deficit (representational neglect) and transsaccadic working memory or spatial remapping deficit (ipsilesional productive manifestations). Taking into account the different facets of the unilateral neglect syndrome should promote the development of more targeted cognitive rehabilitation protocols.",Ann Phys Rehabil Med,60,3,177-185,10.1016/j.rehab.2016.03.003
S. L. Rogers and N. Fay,2016,Stick or Switch: A Selection Heuristic Predicts when People Take the Perspective of Others or Communicate Egocentrically,"This paper examines a cognitive mechanism that drives perspective-taking and egocentrism in interpersonal communication. Using a conceptual referential communication task, in which participants describe a range of abstract geometric shapes, Experiment 1 shows that perspective-taking and egocentric communication are frequent communication strategies. Experiment 2 tests a selection heuristic account of perspective-taking and egocentric communication. It uses participants' shape description ratings to predict their communication strategy. Participants' communication strategy was predicted by how informative they perceived the different shape descriptions to be. When participants' personal shape description was perceived to be more informative than their addressee's shape description, there was a strong bias to communicate egocentrically. By contrast, when their addressee's shape description was perceived to be more informative, there was a strong bias to take their addressee's perspective. When the shape descriptions were perceived to be equally informative, there was a moderate bias to communicate egocentrically. This simple, but powerful, selection heuristic may be critical to the cumulative cultural evolution of human communication systems, and cumulative cultural evolution more generally.",PLoS One,11,7,e0159570,10.1371/journal.pone.0159570
E. T. Rolls,1999,Spatial view cells and the representation of place in the primate hippocampus,"Discusses neurophysiological studies of how space is represented in the primate hippocampus and how this is related to memory and spatial functions of the hippocampus. Information represented in the primate hippocampus was analyzed by making recordings in monkeys actively walking. In a sample of 352 cells recorded, no place cells were found, but a considerable population of spatial view cells were found that tuned to respond when the monkey looked at small parts of the environment. Research has demonstrated: (1) these hippocampal neurons respond to a view of space, not to the monkey's location; (2) responses depend on where the monkey is looking; (3) responses in some cases (e.g., CA1 but not CA3) still occur if view details are obscured; (4) cells retain part of their space tuning even in darkness, for several minutes; and (5) spatial representation is allocentric. This representation of space by primate spatial view cells would be an appropriate part of a system involved in memories of particular episodes of where in an environment an object was seen. Spatial view cells (in conjunction with whole body motion cells in the primate hippocampus, and head direction cells in the primate presubiculum) would also be useful as a memory component in a spatial navigation system. (PsycINFO Database Record (c) 2016 APA, all rights reserved)",Hippocampus,9,4,467-480,10.1002/(SICI)1098-1063(1999)9:4<467::AID-HIPO13>3.0.CO;2-F
"E. T. Rolls, J. Xiang and L. Franco",2005,"Object, Space, and Object-Space Representations in the Primate Hippocampus","Afundamental question about the function of the primate including human hippocampus is whether object as well as allocentric spatial information is represented. Recordings were made from single hippocampal formation neurons while macaques performed an object-place memory task that required the monkeys to learn associations between objects and where they were shown in a room. Some neurons (10%) responded differently to different objects independently of location; other neurons (13%) responded to the spatial view independently of which object was present at the location; and some neurons (12%) responded to a combination of a particular object and the place where it was shown in the room. These results show that there are separate as well as combined representations of objects and their locations in space in the primate hippocampus. This is a property required in an episodic memory system, for which associations between objects and the places where they are seen are prototypical. The results thus provide an important advance by showing that a requirement for a human episodic memory system, separate and combined neuronal representations of objects and where they are seen out there in the environment, is present in the primate hippocampus. (PsycINFO Database Record (c) 2016 APA, all rights reserved) (Source: journal abstract)",Journal of Neurophysiology,94,1,833-844,10.1152/jn.01063.2004
E. T. Rolls and J. Z. Xiang,2006,Spatial view cells in the primate hippocampus and memory recall,"Hippocampal spatial view neurons in primates provide allocentric representations of a view of space 'out there'. The responses depend on where the monkey is looking; and can be updated by idiothetic (self-motion) inputs provided by eye movements when the view is hidden. In a room-based object-place memory task, some hippocampal neurons respond to the objects shown, some to the places viewed, and some to combinations of the places viewed and the objects present in those locations. In an object-place recall task when the location in space at which an object has been seen is recalled by the presentation of the object, some primate hippocampal neurons maintain their responding to the object recall cue in a delay period without the object visible while the place is being recalled; and other neurons respond to the place being recalled. Other spatial view neurons form associations with the rewards present at particular locations in space. These findings, and computational models of the hippocampus, help to show how the primate including human hippocampus is involved in episodic memory.",Reviews in the neurosciences,17,1-2,175-200,
"L. Rondi-Reig, G. H. Petit, C. Tobin, S. Tonegawa, J. Mariani and A. Berthoz",2006,Impaired sequential egocentric and allocentric memories in forebrain-specific-NMDA receptor knock-out mice during a new task dissociating strategies of navigation,"The hippocampus is considered to play a role in allocentric but not in egocentric spatial learning. How does this view fit with the emerging evidence that the hippocampus and possibly related cortical areas are necessary for episodic-like memory, i.e., in all situations in which events need to be spatially or sequentially organized? Are NMDA receptor-dependent mechanisms crucial for the acquisition of spatiotemporal relationships? To address this issue, we used knock-out (KO) mice lacking hippocampal CA1 NMDA receptors and presenting a reduction of these receptors in the deep cortical layers (NR1-KO mice). A new task (the starmaze) was designed, allowing us to distinguish allocentric and sequential-egocentric memories. NR1-KO mice were impaired in acquiring both types of memory. Our findings suggest that memories composed of multiple spatiotemporal events require intact NMDA receptors-dependent mechanisms in CA1 and possibly in the deep cortical layers.",J Neurosci,26,15,4071-4081,10.1523/JNEUROSCI.3408-05.2006
"R. S. Rosenbaum, B. N. Cassidy and K. A. Herdman",2015,Patterns of preserved and impaired spatial memory in a case of developmental amnesia,"The hippocampus is believed to have evolved to support allocentric spatial representations of environments as well as the details of personal episodes that occur within them, whereas other brain structures are believed to support complementary egocentric spatial representations. Studies of patients with adult-onset lesions lend support to these distinctions for newly encountered places but suggest that with time and/or experience, schematic aspects of environments can exist independent of the hippocampus. Less clear is the quality of spatial memories acquired in individuals with impaired episodic memory in the context of a hippocampal system that did not develop normally. Here we describe a detailed investigation of the integrity of spatial representations of environments navigated repeatedly over many years in the rare case of H.C., a person with congenital absence of the mammillary bodies and abnormal hippocampal and fornix development. H.C. and controls who had extensive experience navigating the residential and downtown areas known to H.C. were tested on mental navigation tasks that assess the identity, location, and spatial relations among landmarks, and the ability to represent routes. H.C. was able to represent distances and directions between familiar landmarks and provide accurate, though inefficient, route descriptions. However, difficulties producing detailed spatial features on maps and accurately ordering more than two landmarks that are in close proximity to one another along a route suggest a spatial representation that includes only coarse, schematic information that lacks coherence and that cannot be used flexibly. This pattern of performance is considered in the context of other areas of preservation and impairment exhibited by H.C. and suggests that the allocentric-egocentric dichotomy with respect to hippocampal and extended hippocampal system function may need to be reconsidered.",Frontiers in human neuroscience,9,,196,10.3389/fnhum.2015.00196
"R. S. Rosenbaum, S. Priselac, S. Kohler, S. E. Black, F. Gao, L. Nadel and M. Moscovitch",2000,Remote spatial memory in an amnesic person with extensive bilateral hippocampal lesions,"The hippocampus may have a time-limited role in memory, being needed only until information is permanently stored elsewhere, or this region may permanently represent long-term allocentric spatial information or cognitive maps in memory. To test these ideas, we investigated remote spatial memory in K.C., a patient with bilateral hippocampal lesions and amnesia for autobiographical events. In his spatial knowledge, general aspects were preserved, but details were lost, a pattern that resembled his memory loss in other domains. K.C. performed normally on allocentric spatial tests of his neighborhood and the world. He had difficulty, however, in recognizing and identifying non-salient neighborhood landmarks, and in recognizing city locations on world maps. This suggests that the hippocampus is not crucial for maintenance and retrieval of remotely formed spatial representations of major landmarks, routes, distances and directions, but is necessary for specifying location details, regardless of when they were acquired.",Nat Neurosci,3,10,1044-1048,10.1038/79867
"R. S. Rosenbaum, G. Winocur, C. L. Grady, M. Ziegler and M. Moscovitch",2007,Memory for familiar environments learned in the remote past: fMRI studies of healthy people and an amnesic person with extensive bilateral hippocampal lesions,"Preserved remote spatial memory in amnesic people with bilateral hippocampal damage, including the well-studied case K.C., challenges spatial theories, which assume that the hippocampus is needed to support all allocentric spatial representations, old or new. It remains possible, however, that residual hippocampal tissue is functional and contributes to successful performance. Here, we examine brain activity with fMRI during the retrieval of spatial information in K.C. and in healthy controls using landmark and route stimuli from a premorbidly familiar neighborhood that K.C. can navigate normally. In all participants, activity was found in the parahippocampal cortex, but not in the hippocampus itself, during all navigational tasks on which K.C. performs well, even though part of his hippocampus remains viable. The opposite pattern was observed on a house recognition task, which is inconsequential to navigation, and on which K.C. performed poorly. On that task, K.C. recruited the right hippocampus presumably because even familiar houses were treated as novel by him, whereas controls recruited occipitotemporal cortex, including parahippocampal cortex. The distinction between recent and remote memory, therefore, may apply as much to spatial theories of hippocampal function as it does to theories emphasizing the role of the hippocampus in other types of explicit memory.",Hippocampus,17,12,1241-1251,10.1002/hipo.20354
"R. S. Rosenbaum, M. Ziegler, G. Winocur, C. L. Grady and M. Moscovitch",2004,I have often walked down this street before: fMRI studies on the hippocampus and other structures during mental navigation of an old environment,"The role of the hippocampus in recent spatial memory has been well documented in patients with damage to this structure, but there is now evidence that the hippocampus may not be needed for the storage and recovery of a spatial layout that was experienced long before injury. Such preservation may rely, instead, on a network of dissociable, extra-hippocampal regions implicated in topographical orientation. Using functional magnetic resonance imaging (fMRI), we investigated this hypothesis in healthy individuals with extensive experience navigating in a large-scale urban environment (downtown Toronto). Participants were scanned as they performed mental navigation tasks that emphasized different types of spatial representations. Tasks included proximity judgments, distance judgments, landmark sequencing, and blocked-route problem-solving. The following regions were engaged to varying degrees depending on the processing demands of each task: retrosplenial cortex, believed to be involved in assigning directional significance to locales within a relatively allocentric framework; medial and posterior parietal cortex, concerned with processing space within egocentric coordinates during imagined movement; and regions of prefrontal cortex, present in tasks heavily dependent on working memory. In a second, event-related experiment, a distinct area of inferotemporal cortex was revealed during identification of familiar landmarks relative to unknown buildings in addition to activation of many of those regions identified in the navigation tasks. This result suggests that familiar landmarks are strongly integrated with the spatial context in which they were experienced. Importantly, right medial temporal lobe activity was observed, its magnitude equivalent across all tasks, though the core of the activated region was in the parahippocampal gyrus, barely touching the hippocampus proper.",Hippocampus,14,7,826-835,DOI 10.1002/hipo.10218
