Authors,Year,Title,Abstract,Journal,Volume,Issue,Pages,DOI
"A.-A. Ledoux, P. Boyer, J. L. Phillips, A. Labelle, A. Smith and V. D. Bohbot",2014,Structural hippocampal anomalies in a schizophrenia population correlate with navigation performance on a wayfinding task,"Episodic memory, related to the hippocampus, has been found to be impaired in schizophrenia. Further, hippocampal anomalies have also been observed in schizophrenia. This study investigated whether average hippocampal gray matter (GM) would differentiate performance on a hippocampus-dependent memory task in patients with schizophrenia and healthy controls. Twenty-one patients with schizophrenia and 22 control participants were scanned with an MRI while being tested on a wayfinding task in a virtual town (e.g., find the grocery store from the school). Regressions were performed for both groups individually and together using GM and performance on the wayfinding task. Results indicate that controls successfully completed the task more often than patients, took less time, and made fewer errors. Additionally, controls had significantly more hippocampal GM than patients. Poor performance was associated with a GM decrease in the right hippocampus for both groups. Within group regressions found an association between right hippocampi GM and performance in controls and an association between the left hippocampi GM and performance in patients. A second analysis revealed that different anatomical GM regions, known to be associated with the hippocampus, such as the parahippocampal cortex, amygdala, medial, and orbital prefrontal cortices, covaried with the hippocampus in the control group. Interestingly, the cuneus and cingulate gyrus also covaried with the hippocampus in the patient group but the orbital frontal cortex did not, supporting the hypothesis of impaired connectivity between the hippocampus and the frontal cortex in schizophrenia. These results present important implications for creating intervention programs aimed at measuring functional and structural changes in the hippocampus in schizophrenia. (PsycINFO Database Record (c) 2016 APA, all rights reserved) (Source: journal abstract)",Frontiers in Behavioral Neuroscience,8,,11,10.3389/fnbeh.2014.00088
"A. C. H. Lee, V. L. Scahill and K. S. Graham",2008,Activating the medial temporal lobe during oddity judgment for faces and scenes,"Impairments in visual discrimination beyond long-term declarative memory have been found in amnesic individuals, with hippocampal lesions resulting in deficits in scene discrimination and perirhinal cortex damage affecting object discrimination. To complement these findings, the present functional magnetic resonance imaging study found that in healthy participants oddity judgment for novel trial-unique scenes, compared with face or size oddity, was associated with increased posterior hippocampus and parahippocampal cortex activity. In contrast, perirhinal and anterior hippocampus activity was observed during unfamiliar trial-unique face oddity judgment, when contrasted with scene or size oddity tasks. Activity in all of these regions decreased as the stimuli were repeated across trials, reflecting the participants' increasing familiarity with the stimuli. This change was significant in all areas, with the exception of the perirhinal cortex, right anterior hippocampus, and to a lesser extent the left anterior hippocampus during face oddity judgment. One possibility is that the activity in these regions may not reflect entirely episodic memory encoding but, in part, processes beyond the mnemonic domain. Thus, the perirhinal cortex, and possibly anterior hippocampus, may play a more generic role in the discrimination and processing of objects.",Cerebral Cortex,18,3,683-696,10.1093/cercor/bhm104
I. Lee and J. Kim,2010,The shift from a response strategy to object-in-place strategy during learning is accompanied by a matching shift in neural firing correlates in the hippocampus,"Hippocampal-dependent tasks often involve specific associations among stimuli (including egocentric information), and such tasks are therefore prone to interference from irrelevant task strategies before a correct strategy is found. Using an object-place paired-associate task, we investigated changes in neural firing patterns in the hippocampus in association with a shift in strategy during learning. We used an object-place paired-associate task in which a pair of objects was presented in two different arms of a radial maze. Each object was associated with reward only in one of the arms, thus requiring the rats to consider both object identity and its location in the maze. Hippocampal neurons recorded in CA1 displayed a dynamic transition in their firing patterns during the acquisition of the task across days, and this corresponded to a shift in strategy manifested in behavioral data. Specifically, before the rats learned the task, they chose an object that maintained a particular egocentric relationship with their body (response strategy) irrespective of the object identity. However, as the animal acquired the task, it chose an object according to both its identity and the associated location in the maze (object-in-place strategy). We report that CA1 neurons in the hippocampus changed their prospective firing correlates according to the dominant strategy (i.e., response versus object-in-place strategy) employed at a given stage of learning. The results suggest that neural firing pattern in the hippocampus is heavily influenced by the task demand hypothesized by the animal and the firing pattern changes flexibly as the perceived task demand changes.",Learning & Memory,17,8,381-393,10.1101/lm.1829110
D. Legrand and P. Ruby,2009,What Is Self-Specific? Theoretical Investigation and Critical Review of Neuroimaging Results,,Psychological Review,116,1,252-282,
"C. Lemogne, L. Bergouignan, C. Boni, P. Gorwood, A. Pelissolo and P. Fossati",2009,Genetics and personality affect visual perspective in autobiographical memory,"Major depression is associated with a decrease of 1st person (versus 3rd person) visual perspective in autobiographical memory, even after full remission. This study aimed to examine visual perspective in healthy never-depressed subjects presenting with either genetic or psychological vulnerability for depression. Sixty healthy participants performed the Autobiographical Memory Test with an assessment of visual perspective. Genetic vulnerability was defined by the presence of at least one S or L(G) allele of the polymorphism of the serotonin-transporter-linked promoter region (5-HTTLPR). Psychological vulnerability was defined by high scores of harm avoidance measured by the Temperament and Character Inventory. Life stress exposure, depressive mood, rumination, and familial history of depression were assessed through standardized procedures. Visual perspective for positive memories was independently predicted by both harm avoidance and a gene by environment interaction between the 5-HTTLPR polymorphism and life stress exposure. Visual perspective and vulnerability for depression may share some biological bases.",Conscious Cogn,18,3,823-830,10.1016/j.concog.2009.04.002
"C. Lemogne, L. Bergouignan and P. Fossati",2009,The biology of visual perspective and depression: A reply to Sutin,"Reply by the current author s to the comments made by A. R. Satin (see record 2009-13155-031) on the original article (see record 2009-13155-030). A recent meta-analysis by Munafò, Durrant, Lewis, and Flint (2009) [Munafò, M. R., Durrant, C., Lewis, G., & Flint, J. (2009). Gene × environment interactions at the serotonin transporter locus. Biological Psychiatry, 65, 211–219] questioned the meaning of studies searching for endophenotypes associated with the serotonin-transporter-linked promoter region (5-HTTLPR) polymorphism, including our study on visual perspective during autobiographical memory retrieval. However, the association of 3rd person perspective with vulnerability for depression does not rely only on genetics. External consistency is provided by the influence of the 5-HTTLPR polymorphism on brain regions involved in emotion regulation and autobiographical memory retrieval (e.g. the medial prefrontal cortex). Internal consistency is provided by the increased prevalence of 3rd person perspective in both currently and previously depressed patients, as well as in depression-prone individuals. Further studies should examine therapeutic opportunities. (PsycINFO Database Record (c) 2016 APA, all rights reserved)",Consciousness and Cognition: An International Journal,18,3,834-836,10.1016/j.concog.2009.05.006
"C. Lemogne, L. Bergouignan and P. Fossati",2011,Mémoire émotionnelle du soi,"Emotion shapes autobiographical memory (AM) by tagging events that are relevant for the narrative self, which may be viewed as a hierarchical network of interconnected goals. Subsequent AM retrieval is a reconstruction process that grounds the self by providing coherent narratives organized to elicit a sense of identity across the time. The lateral and medial prefrontal cortices underlie reconstruction and self-referential processing, respectively, whereas the lateral and medial temporal cortices underlie semantic and episodic aspects, respectively. Additionally, the posterior cortical midline structures and the amygdala are involved in visual and emotional aspects, respectively. These regions have been found to display aberrant functioning in major depression. Accordingly, major depression is associated with impairments of AM retrieval combining mood-congruency, overgenerality, intrusive memories and third-person visual perspective. (PsycINFO Database Record (c) 2016 APA, all rights reserved) (Source: journal abstract)",Annales Médico-Psychologiques,169,2,116-119,
"C. Lemogne, L. Bergouignan and P. Fossati",2011,Emotional memory of the self,"Emotion shapes autobiographical memory (AM) by tagging events that are relevant for the narrative self, which may be viewed as a hierarchical network of interconnected goals. Subsequent AM retrieval is a reconstruction process that grounds the self by providing coherent narratives organized to elicit a sense of identity across the time. The lateral and medial prefrontal cortices underlie reconstruction and self-referential processing, respectively, whereas the lateral and medial temporal cortices underlie semantic and episodic aspects, respectively. Additionally, the posterior cortical midline structures and the amygdala are involved in visual and emotional aspects, respectively. These regions have been found to display aberrant functioning in major depression. Accordingly, major depression is associated with impairments of AM retrieval combining mood-congruency, overgenerality, intrusive memories and third-person visual perspective. (C) 2010 Elsevier Masson SAS. All rights reserved.",Annales Medico-Psychologiques,169,2,116-118,10.1016/j.amp.2010.12.004
C. Lemogne and P. Fossati,2012,Souvenirs intrusifs au cours des troubles de l’humeur,"AM retrieval is a reconstruction process that grounds the self by providing coherent narratives organized to elicit a sense of identity across the time. Major depression is associated with impairments of AM retrieval, combining a mood congruent recall, a lack of specificity, an increased prevalence of the third-person visual perspective and frequent intrusive memories, which are characterized by an involuntary, fast and effortless recall. Intrusive memories in depression relate to a broad range of negative life events and are usually vivid, distressful and associated with a poorer outcome as well as with typical depressogenic cognitive biases, especially with cognitive avoidance. To date, little is known about the neural bases of these memories. These bases are likely to partially mirror those of the depressive state, with a decreased cognitive control over unwanted thoughts by the prefrontal cortex and an increased amygdala activation. (PsycINFO Database Record (c) 2016 APA, all rights reserved) (Source: journal abstract)",Annales Médico-Psychologiques,170,3,193-196,
C. Lemogne and P. Fossati,2012,Intrusive memories in mood disorders,"AM retrieval is a reconstruction process that grounds the self by providing coherent narratives organized to elicit a sense of identity across the time. Major depression is associated with impairments of AM retrieval, combining a mood congruent recall, a lack of specificity, an increased prevalence of the third-person visual perspective and frequent intrusive memories, which are characterized by an involuntary, fast and effortless recall. Intrusive memories in depression relate to a broad range of negative life events and are usually vivid, distressful and associated with a poorer outcome as well as with typical depressogenic cognitive biases, especially with cognitive avoidance. To date, little is known about the neural bases of these memories. These bases are likely to partially mirror those of the depressive state, with a decreased cognitive control over unwanted thoughts by the prefrontal cortex and an increased amygdala activation. (C) 2012 Elsevier Masson SAS. All rights reserved.",Annales Medico-Psychologiques,170,3,193-196,10.1016/j.amp.2012.02.005
"B. Levine, G. R. Turner, D. Tisserand, S. J. Hevenor, S. J. Graham and A. R. McIntosh",2004,The Functional Neuroanatomy of Episodic and Semantic Autobiographical Remembering: A Prospective Functional MRI Study,"Autobiographical memory comprises episodic and semantic components mediated by dissociable states of consciousness, one promoting the experience of the self at a specific moment in the past, and the other involving self-knowledge that does not require mental time travel. These components can be difficult to dissociate using retrospective autobiographical stimuli collection. In this study, we manipulated the episodic/semantic distinction within prospectively collected autobiographical stimuli. Over several months, participants made recordings documenting specific episodes, repeated episodes, and world knowledge. These recordings were later played back to participants during scanning with functional MRI. The results indicated overlapping but distinct patterns of brain activity corresponding to episodic and semantic autobiographical memory. Both episodic and semantic autobiographical memory engaged the left anteromedial prefrontal cortex associated with self-reference, but the episodic condition did so to a greater degree. The episodic condition uniquely engaged the medial temporal, posterior cingulate, and diencephalic regions associated with remote memory recovery. Whereas the episodic condition engaged the right temporo-parietal cortex involved in reconstruction of spatial context and attentional orienting, the semantic condition engaged the left temporo-parietal and parieto-frontal systems involved in egocentric spatial processing and topdown attentional control. Episodic recollection was also associated with suppression of emotional paralimbic regions. These findings support a functional neuroanatomical dissociation between episodic and semantic autobiographical memory, providing concordance to amnesic syndromes with disproportionate impairment in one of these two forms of autobiographical memory. (PsycINFO Database Record (c) 2016 APA, all rights reserved) (Source: journal abstract)",Journal of Cognitive Neuroscience,16,9,1633-1646,10.1162/0898929042568587
"P. A. Leynes, B. Askin and J. D. Landau",2017,Visual perspective during remembering: ERP evidence of familiarity-based source monitoring,"Autobiographical recollections are accompanied by visual perspectives that can be either a view through the person's own eyes (first-person) or a view that integrates visual characteristics of the rememberer into the reconstructed scene (third-person). Some have argued that a third-person perspective serves as a coping mechanism allowing the person to distance themselves from details of painful memories. The study reported here created first- and third-person memories in a novel experimental paradigm. Later, participants discriminated between these perspectives on a source memory test while event-related potentials (ERPs) were recorded. Experimental evidence from the current study suggests that memories from different perspectives can be effectively modeled in the lab. Directly comparing first-person and third-person memories revealed no strong source memory or ERP differences; however, more first-person memories were recognized. Surprisingly, the modeling of the behavioral data using ROC curves and Dual Process Signal Detection (DPSD) measures of recollection and familiarity suggest that familiarity contributed to source judgments of both first- and third-person memories. The ERP data support this claim because the putative ERP correlate of familiarity (i.e., FN400) was observed during the source test. Because source monitoring tends to draw on recollection, evidence of familiarity-based source monitoring has been elusive, and these results support a key prediction of the Source Monitoring Framework (SMF) - that source decisions can be based on familiarity in some contexts (Johnson, Hashtroudi, & Lindsay, 1993; Mitchell & Johnson, 2009).",Cortex,91,,157-168,10.1016/j.cortex.2016.12.003
L. K. Libby and R. P. Eibach,2002,Looking back in time: Self-concept change affects visual perspective in autobiographical memory,"People who change often report that their old selves seem like different people. Correlational (Study 1) and experimental (Studies 2 and 3) studies showed that participants tended to use a 3rd-person observer perspective when visualizing memories of actions that conflicted with their current self-concept. A similar pattern emerged when participants imagined performing actions that varied in self-concept compatibility (Study 4). The authors conclude that on-line judgments of an action's self-concept compatibility affect the perspective used for image construction. Study 5 shows applied implications. Use of the 3rd-person perspective when recalling past episodes of overindulgent eating was related to optimism about behaving differently at an upcoming Thanksgiving dinner. The authors discuss the effect of self-concept compatibility on cognitive and emotional reactions to past actions and consider the role of causal attributions in defining the self across time. (PsycINFO Database Record (c) 2016 APA, all rights reserved) (Source: journal abstract)",Journal of Personality and Social Psychology,82,2,167-179,
L. K. Libby and R. P. Eibach,2011,Self-enhancement or self-coherence? Why people shift visual perspective in mental images of the personal past and future,"It is often assumed, by laypeople and researchers alike, that people shift visual perspective in mental images of life events to maintain a positive self-concept by claiming ownership of desirable events (first-person) and disowning undesirable events (third-person). The present research suggests that people shift perspective not according to the pictured event's desirability but according to whether they focus on the experience of the event (first-person) or on the event's coherence with the self-concept (third-person). This explains why self-change promotes third-person imagery of prechange selves (Studies 1 and 2). And, the same mechanism determines perspective apart from self-change, in both memory and imagination (Studies 3 and 4). By demonstrating that people shift perspective according to whether they focus on the experience of an event or its self-concept coherence, these results suggest how perspective may function more broadly in social cognition, and specifically in the construction and maintenance of the temporally extended self.",Pers Soc Psychol Bull,37,5,714-726,10.1177/0146167211400207
"L. K. Libby, E. M. Shaeffer and R. P. Eibach",2009,Seeing Meaning in Action: A Bidirectional Link Between Visual Perspective and Action Identification Level,"Actions do not have inherent meaning but rather can be interpreted in many ways. The interpretation a person adopts has important effects on a range of higher order cognitive processes. One dimension on which interpretations can vary is the extent to which actions are identified abstractly-in relation to broader goals, personal characteristics, or consequences-versus concretely, in terms of component processes. The present research investigated how visual perspective (own 1st-person vs. observer's 3rd-person) in action imagery is related to action identification level. A series of experiments measured and manipulated visual perspective in mental and photographic images to test the connection with action identification level. Results revealed a bidirectional causal relationship linking 3rd-person images and abstract action identifications. These findings highlight the functional role of visual imagery and have implications for understanding how perspective is involved in action perception at the social, cognitive, and neural levels.",Journal of Experimental Psychology-General,138,4,503-516,10.1037/a0016795
"L. K. Libby, E. M. Shaeffer, R. P. Eibach and J. A. Slemmer",2007,Picture yourself at the polls: Visual perspective in mental imagery affects self-perception and behavior,"The present research demonstrates that the visual perspective--own first-person versus observer's third-person--people use to picture themselves engaging in a potential future action affects their self-perceptions and subsequent behavior. On the eve of the 2004 U.S. presidential election, registered voters in Ohio were instructed to use either the first-person or the third-person perspective to picture themselves voting in the election. Picturing voting from the third-person perspective caused subjects to adopt a stronger pro-voting mind-set correspondent with the imagined behavior. Further, this effect on self-perception carried over to behavior, causing subjects who were instructed to picture voting from the third-person perspective to be significantly more likely to vote in the election. These findings extend previous research in autobiographical memory and social judgment linking the observer's perspective with dispositional attributions, and demonstrate the causal role of imagery in determining future behavior. (PsycINFO Database Record (c) 2016 APA, all rights reserved) (Source: journal abstract)",Psychological Science,18,3,199-203,DOI 10.1111/j.1467-9280.2007.01872.x
S. E. Lind and D. M. Bowler,2010,Episodic memory and episodic future thinking in adults with autism,"The ability to remember past experiences (episodic memory) is thought to be related to the ability to imagine possible future experiences (episodic future thinking). Although previous research has established that individuals with autism spectrum disorder (ASD) have diminished episodic memory, episodic future thinking has not previously been investigated within this population. In the present study, high-functioning adults with ASD were compared to closely matched typical adults on a task requiring participants to report a series of events that happened to them in the past and a series of events that might happen to them in the future. For each event described, participants completed two modified Memory Characteristics Questionnaire items to assess self-reported phenomenal qualities associated with remembering and imagining, including self-perspective and degree of autonoetic awareness. Participants also completed letter, category, and ideational fluency tasks. Results indicated that participants with ASD recalled/imagined significantly fewer specific events than did comparison participants and that participants with ASD demonstrated impaired episodic memory and episodic future thinking. In line with this finding, participants with ASD were less likely than comparison participants to report taking a field (first-person) perspective and were more likely to report taking an observer (third-person) perspective during retrieval of past events (but not during simulation of future events), highlighting that they were less likely to mentally reexperience past events from their own point of view. There were no group differences in self-reported levels of autonoetic awareness or fluency task performance. (PsycINFO Database Record (c) 2017 APA, all rights reserved) (Source: journal abstract)",Journal of Abnormal Psychology,119,4,896-905,10.1037/a0020631
